,analysis_notes,morph_notes,corrected_date,corrected_1s,corrected_1s_%,radius,Ft,uncorrected_date,uncorrected_1s,uncorrected_1s_%,U_ng,U_ng_1s,Th_ng,Th_ng_1s,Sm_ng,Sm_ng_1s,He_pmol,He_pmol_1s,mass_morph_g,U_ppm,Th_ppm,Sm_ppm,eU
NFCT-3,,,25.65968674,0.445239432,1.735170958,86.14483284,0.852838304,21.8912014,0.378658909,1.729731054,3.478350823,0.066361815,1.688802875,0.035619031,0,0,0.458282001,0.00218063,5.37E-06,647.7908957,314.5143153,0,721.7017598
JI38.45-5,,Possible small roundish inclusion on one side,7.037539186,0.156640877,2.225790471,47.93997067,0.747284527,5.259848752,0.116817881,2.220936133,2.789601676,0.054905763,0.307114193,0.006205979,0,0,0.081133598,0.001000949,5.37E-06,519.5216528,57.19543208,0,532.9625793
JI38.45-6,,"ASK WILLY Small spherical opening on one side, also makes it hard for measurements, but unsure how much it affects diffusion?",59.60920762,0.901763453,1.512792215,68.71063978,0.819538534,48.89902569,0.737634491,1.508485048,4.063455366,0.064431414,0.431957173,0.011136871,0,0,1.102174702,0.00216272,5.37E-06,756.757879,80.44557269,0,775.6625886
JI38.45-8,,"hard to tell where corners are, but peaks strongly present",158.6958348,2.338703047,1.473701594,70.06978833,0.822760161,130.8988501,1.92044562,1.467121842,3.08268704,0.047336652,0.379318147,0.008987754,0,0,2.264133984,0.004377426,5.37E-06,574.104425,70.64234017,0,590.7053749
JI38.45-9,,one peak absent but other very prominent. Odd slight curve on one side,71.71897054,0.889425239,1.240153383,65.98843044,0.812512216,58.3426783,0.72127376,1.236271252,3.655747369,0.047233506,0.385169521,0.009316796,0,0,1.18386677,0.002332097,5.37E-06,680.8283532,71.73207117,0,697.6853899
JI38.45-11,,liiiittle knick in one corner,101.4423244,1.595913823,1.573222845,49.63070009,0.755390055,76.79912268,1.202466893,1.565729986,1.964850884,0.032151401,0.179181353,0.005428744,0,0,0.836276209,0.001669441,5.37E-06,365.9241344,33.36985112,0,373.7660494
JI38.45-16,,black dot-ish in center,332.5014349,4.270199361,1.284264942,82.50987546,0.848171768,283.3060381,3.615582171,1.27621077,3.291659757,0.043438105,0.489961135,0.010367692,0,0,5.339208077,0.010284068,5.37E-06,613.0224728,91.24794447,0,634.4657397
JI38.45-18,,just too small on one side. Basicaly ellipsoid. Very clear,886.493285,17.29005551,1.950387646,46.70330014,0.736720119,666.4866707,12.64863986,1.897808376,0.331506727,0.007078853,0.244590022,0.005539798,0,0,1.482436221,0.002883728,5.37E-06,61.73817717,45.55123895,0,72.44271832
NFCT-4,pretty low but I can't find anything that was wrong,"Two inclusions, very thin and elongate",19.83282037,0.272414614,1.37355459,65.68029581,0.808043829,16.03176265,0.219774239,1.370867597,1.395696615,0.018647418,1.115987152,0.028542304,0,0,0.143592809,0.001056635,5.37E-06,259.9276514,207.8359412,0,308.7690976
JI38.45-20,,possible core or zonation visible,53.76814841,1.037135928,1.928903931,51.63248931,0.764132008,41.13245404,0.790551946,1.9219664,1.783646374,0.035577731,0.176101076,0.005049466,0,0,0.405952732,0.00156216,5.37E-06,332.1775005,32.79619551,0,339.8846065
JI38.45-22,,"One edge abraded, decreasing w2 and h2b",22.81247136,0.40953769,1.795235966,53.46877036,0.771743494,17.61345568,0.315337029,1.790318917,3.224817538,0.059539691,0.285328903,0.006056561,0,0,0.312862584,0.001283145,5.37E-06,600.5741076,53.13824721,0,613.0615957
JI38.45-23,,"R o u n d and yet seems like it has peaks and terminations? Unclear, but very close to being a spheroid though",541.5033222,7.808433014,1.44199171,47.29128558,0.744027258,408.0253045,5.797151908,1.420782448,0.559630528,0.007800378,0.066191983,0.004044673,0,0,1.314033325,0.004932528,5.37E-06,104.2228285,12.32726833,0,107.1197365
JI211.2-1,,,345.3040604,5.851005461,1.694450234,71.34172568,0.824378176,286.183714,4.808097632,1.680073812,2.412434734,0.04343985,0.924295313,0.016669888,0,0,4.162299873,0.01552341,5.37E-06,449.2799424,172.1361988,0,489.7319492
JI211.2-3,,has a growth on the side that might be another crystal. Possible complication,36.83063984,0.637308942,1.730377057,144.3971256,0.910621525,33.54872994,0.579286098,1.72670053,4.088460713,0.079682192,2.102315132,0.034590545,0,0,0.831391628,0.003131298,5.37E-06,761.4147514,391.5247977,0,853.4230789
JI211.2-4,,Possible growth on one side,781.8318018,13.2401597,1.693479296,51.40958216,0.7614021,605.3814137,10.03767216,1.658074056,2.903948969,0.049624151,1.016713572,0.017576523,0,0,10.84450876,0.040423355,5.37E-06,540.8171284,189.3477193,0,585.3138424
JI211.2-5,,Section might have one tip present? Either that or missing half of one section,214.6776557,3.948278402,1.839165976,68.36015407,0.817103761,176.0186519,3.215316263,1.826690653,1.83396399,0.036456275,0.712821656,0.014855007,0,0,1.929127759,0.007205867,5.37E-06,341.548405,132.7523883,0,372.7452162
JI211.2-6,,"Section, dark brown yellow, kind of shaped like a rocket ship, but one side more angular then the other",63.91506972,0.947789218,1.482888499,84.39138672,0.850007458,54.37433769,0.803199632,1.477166741,16.40045437,0.270375704,7.592561855,0.110438565,0,0,5.356510684,0.01694606,5.37E-06,3054.339705,1414.00126,0,3386.630001
NFCT-5,,"Lots of inclusions, small black lines",19.98748367,0.257417664,1.287894304,105.4934097,0.878603677,17.56513189,0.225604798,1.284390005,7.059652595,0.101184173,4.034400558,0.055846088,0,0,0.75968061,0.002884659,5.37E-06,1314.754868,751.3468549,0,1491.321379
JI211.2-8,,"Section, sort of dark and moderately fracture. Shaped like a pull-apart basin",324.5623131,4.702645313,1.44891909,82.19264272,0.84627821,275.8702242,3.968099239,1.438393451,3.705191448,0.057823877,1.625718823,0.025715948,0,0,6.229820901,0.019706562,5.37E-06,690.0365746,302.7658527,0,761.18655
JI211.2-9,,"Section dark yellow, no inclusions but fractures look like one",329.7875487,4.525315038,1.372190992,86.04707359,0.852994453,282.505407,3.849670651,1.362689193,6.628311148,0.09711331,2.709544037,0.038535571,0,0,11.3472572,0.035890046,5.37E-06,1234.423965,504.6121131,0,1353.007812
JI631.5-2,laser crashed toward end,"one pyramid completely gone, few um knick in the side, but not the worst I've seen",349.1961632,5.759219744,1.649279217,66.90343407,0.813738041,285.7969689,4.67204361,1.634742183,4.94479092,0.085953517,1.556684484,0.029888699,0,0,8.395271343,0.026557024,5.37E-06,920.8934644,289.9092379,0,989.0221353
JI631.5-3,,"Very cracked grain overall, one side has clearer, partally abraded termination whereas the other is broken off",105.2737792,1.441590146,1.369372466,81.62907429,0.845709087,89.15873106,1.216084256,1.363954199,9.308138138,0.136940752,3.150823199,0.052911354,0,0,4.867741036,0.015410825,5.37E-06,1733.501722,586.7937671,0,1871.398258
JI631.5-4,,"Section, dark yellow, part of one side missing so width might be too shor",99.59262456,1.817544385,1.824978901,71.00124457,0.823936691,82.18539392,1.493004073,1.816629454,7.114648434,0.140863881,2.228122679,0.032620326,0,0,3.408515792,0.010798102,5.37E-06,1324.997022,414.9545745,0,1422.511347
JI631.5-5,,"Section, clear and no cracks but slightly yellow",4.364928719,0.087227386,1.998369078,56.90985037,0.781387405,3.411159965,0.067848991,1.989029891,6.208995141,0.131768985,3.829587459,0.074212541,0,0,0.130824295,0.001112554,5.37E-06,1156.332621,713.2034739,0,1323.935438
NFCT-6,Starting at 1100 C because the other FCTs have been really hard,Slight bits of another crystal on one side,26.34951713,0.337402289,1.280487561,57.19440273,0.782934615,20.64089987,0.262981256,1.274078445,2.600494896,0.036822199,1.355846889,0.021276126,0,0,0.325482307,0.001123792,6.65E-06,390.8298086,203.7709749,0,438.7159877
JI741.4-2,,possible small inclusion in lower half. Weird left-trending bend in the lower half of the grain,59.52215939,1.021962543,1.71694467,46.32395678,0.738842097,44.03847755,0.752827234,1.709476066,3.076272559,0.052370439,0.468426579,0.008751043,0,0,0.759107841,0.004786829,3.93E-06,782.7217481,119.185691,0,810.7303855
JI741.4-3,,"Half grain. Elongate crack parallel to c-axis, pretty clear grain",691.4896084,12.27174526,1.774682528,92.1193247,0.862671823,601.6526675,10.56576949,1.756124431,5.869102316,0.100542545,1.855069698,0.035777018,0,0,21.61867296,0.135323139,3.93E-06,1493.324774,472.0008935,0,1604.244984
JI741.4-4,,"Section, no terminations, yellowish, highly fractured",147.5937926,2.474966066,1.6768768,87.95884144,0.856110696,126.5920872,2.113900922,1.669852334,10.0870296,0.174467832,3.990395132,0.069581015,0,0,7.608599959,0.047629848,3.93E-06,2566.527279,1015.309597,0,2805.125034
JI741.4-5,,Half grain. Pretty dark brown but still translucent,233.4878212,4.21521497,1.805325412,89.42812741,0.859384521,201.2481602,3.616991425,1.79727925,10.49244822,0.186666939,1.690837391,0.031315364,0,0,12.02986117,0.075302467,3.93E-06,2669.68133,430.2138944,0,2770.781595
JI741.4-6,,"Section, yellowish brown, very solid and thick",138.0666658,2.185198173,1.582712351,150.0629341,0.914224937,126.3552489,1.995118548,1.578975598,9.58881775,0.155206797,3.723533456,0.052653357,0,0,7.207803124,0.045142191,3.93E-06,2439.763073,947.4097499,0,2662.404364
JI741.4-7,,"Section, pretty broken inset  on one side but mostly whole",254.9579184,4.728735557,1.854712176,77.62731511,0.838084228,214.4545461,3.952064861,1.842844991,4.290636439,0.084194634,1.494651878,0.025346396,0,0,5.470174517,0.025238651,3.93E-06,1091.702503,380.2967741,0,1181.072245
NFCT-9,,Kind of rough on the edges but well-preserved peaks. Some elongated inclusions,29.68283128,0.450504199,1.517726509,43.61944736,0.721205539,21.42376293,0.323092511,1.508103463,1.485174624,0.023869082,0.775902572,0.01358227,0,0,0.192993097,0.001121666,2.98E-06,498.3216201,260.3391011,0,559.5013088
JI741.4-8,,"Section, unclear whether termination present",137.4121505,1.87575264,1.36505588,73.37390151,0.829316406,114.1943227,1.55187422,1.358976684,5.841365515,0.081932665,1.861390621,0.040625877,0,0,3.90436729,0.018024058,2.98E-06,1959.95722,624.5536214,0,2106.727321
JI741.4-9,,"Section, unclear whether one side is a termination. Flecks of other grains on side, but are not a large proportion",118.9422288,1.804828619,1.517399361,88.02920675,0.856319174,102.005735,1.541809737,1.51149319,14.93581814,0.239855201,5.555062237,0.088806044,0,0,9.011850576,0.041573781,2.98E-06,5011.424902,1863.893692,0,5449.43992
JIBFCT-1,BFCT are broken FCT,"Mostly inclusion free, crack down c-axis, chip in side",26.81871347,0.396340607,1.477850932,62.95422471,0.799129086,21.44252048,0.315111724,1.469564757,1.744410769,0.030134944,1.826629487,0.032087093,0,0,0.252000178,0.001283597,2.98E-06,585.3032944,612.8901952,0,729.3324903
JIBFCT-2,,Small inclusions close to center,26.69120101,0.374492783,1.403057071,106.9054593,0.88048211,23.50801931,0.329068225,1.399812638,3.676154961,0.055046925,1.730839874,0.031428271,0,0,0.518563431,0.002542079,2.98E-06,1233.462696,580.7498432,0,1369.938909
JIBFCT-4,,1 diagonal inclusion. Hard to tell if peaked or not,21.57538015,0.377088039,1.74777008,78.78407243,0.839502182,18.11849588,0.315452142,1.741050385,1.972938237,0.03921841,1.062120029,0.019534049,0,0,0.217488543,0.000704928,2.98E-06,661.9812666,356.3738329,0,745.7291173
JIBFCT-5,Laser maxed out at 827 C,"No visible inclusions!! Possible peak present, but broken enough that I can't tell",26.11150362,0.418732943,1.603633972,103.8822847,0.876277495,22.88782345,0.365767809,1.598089088,2.761518695,0.052553686,2.020137391,0.033276272,0,0,0.400338229,0.000921913,2.98E-06,926.574187,677.8180297,0,1085.861424
JIBFCT-7,,"Very minor inclusions, ever so slightly yellow, one side curves",29.47194791,0.412531576,1.399743165,82.6639702,0.845594098,24.93179843,0.347416151,1.393466068,2.894048883,0.048410281,2.383579695,0.037735488,0,0,0.465602248,0.001102799,2.98E-06,971.0421284,799.7640654,0,1158.986684
JIBFCT-8,,Small round inclusion near very center,25.95806871,0.410572141,1.58167445,64.9643297,0.806269938,20.93910775,0.329589256,1.574036772,1.152686814,0.020601869,0.866737575,0.017219315,0,0,0.15348286,0.000769184,2.98E-06,386.761766,290.8170295,0,455.1037679
NFCT-10,,"Kind of rough on the edges as well, slightly abraded peaks. Streaky in the middle",27.32800668,0.491679287,1.799177278,52.11723061,0.762190356,20.84182203,0.372346854,1.786536961,2.7269287,0.057713434,1.942570627,0.037347781,0,0,0.35852879,0.000963864,5.37E-06,507.8497469,361.7747692,0,592.8668177
JIBFCT-9,,"Inclusion-free, some edges slightly abraded but peak well-preserved",27.62333341,0.440725509,1.595482713,77.21295266,0.836288615,23.11073198,0.367225056,1.588980636,2.981029932,0.054253247,1.676499137,0.028649516,0,0,0.421461692,0.001264641,5.37E-06,555.1723066,312.2229277,0,628.5446946
